{
    "interfaceVersion": "v1",
    "id": "0192b0a0-7e1d-7000-8000-000000000084",
    "name": "Cyclic graph",
    "firstNode": "0192b0a0-7e1d-7000-8000-000000000085",
    "steps": [
        {
            "id": "0192b0a0-7e1d-7000-8000-000000000085",
            "type": "task",
            "config": { "operation": "first" },
            "successors": ["0192b0a0-7e1d-7000-8000-000000000086"]
        },
        {
            "id": "0192b0a0-7e1d-7000-8000-000000000086",
            "type": "task",
            "config": { "operation": "second" },
            "successors": ["0192b0a0-7e1d-7000-8000-000000000085"]
        }
    ]
}
