{
    "interfaceVersion": "v1",
    "id": "0192b0a0-7e1d-7000-8000-0000000000d7",
    "name": "Reference to undeclared input",
    "firstNode": "0192b0a0-7e1d-7000-8000-0000000000d8",
    "steps": [
        {
            "id": "0192b0a0-7e1d-7000-8000-0000000000d8",
            "type": "task",
            "config": { "operation": "greet" },
            "inputs": { "name": { "ref": "inputs.username" } },
            "successors": ["0192b0a0-7e1d-7000-8000-0000000000d9"]
        },
        { "id": "0192b0a0-7e1d-7000-8000-0000000000d9", "type": "result", "inputs": {} }
    ]
}
